{
  "archive_url": null,
  "checksum": null,
  "country_codes": [
    "TN"
  ],
  "id": "SRC-UNESCO-ICH-TN-2026",
  "language": "ar-fr-en",
  "license": "UNESCO website terms; quoted facts and titles only",
  "locator": "Tunisia ICH list and element records 01406, 01710, and Charfia fishing record",
  "notes": "Publication date unavailable on the live state page; individual decisions supply inscription years and descriptions.",
  "publication_date": null,
  "publisher": "UNESCO",
  "quality_tier": "A",
  "retrieved_at": "2026-08-15",
  "schema_version": "1.0.0",
  "source_type": "institutional_dataset",
  "title": "Intangible Cultural Heritage — Tunisia elements",
  "url": "https://ich.unesco.org/en/state/tunisia-TN"
}
