{
  "archive_url": null,
  "checksum": null,
  "country_codes": [
    "TN"
  ],
  "id": "SRC-TN-DGCL-MUNICIPALITIES-2018",
  "language": "fr",
  "license": "License not stated in the publication metadata",
  "locator": "Administrative overview stating 24 governorates and 350 communes after creation of 86 new municipalities",
  "notes": "Provides a dated 2018 denominator, not proof that the same denominator is current in 2026.",
  "publication_date": "2018-04-06",
  "publisher": "Direction Générale des Collectivités Locales, Tunisie",
  "quality_tier": "A",
  "retrieved_at": "2026-08-15",
  "schema_version": "1.0.0",
  "source_type": "official_report",
  "title": "Rapport de synthèse sur la nouvelle carte des municipalités",
  "url": "http://www.collectiviteslocales.gov.tn/wp-content/uploads/2018/04/Rapport_synthese_vf-2018.pdf"
}
