{
  "archive_url": null,
  "checksum": "sha256:d34522cce1eca2c9dd956b9e074f0dbf71af4e5f4a4c32bde045e625b51cb6fb",
  "country_codes": [
    "AE"
  ],
  "id": "SRC-AE-UAE-UAQ-2024",
  "language": "en",
  "license": "Official UAE Government portal; reuse terms not stated on captured page",
  "locator": "fishing, coastal mangroves and traditional activities paragraphs",
  "notes": "Persisted bounded relevant-text extract: data/imports/uae/raw/2026-08-15/uaq-profile-2024.txt. Checksum binds that extract (530 bytes), not a full-page HTTP archive. Capture scope: relevant_exact_excerpt. Publication date unavailable on the captured page; no date was inferred.",
  "publication_date": null,
  "publisher": "The Official Platform of the UAE Government",
  "quality_tier": "A",
  "retrieved_at": "2026-08-15",
  "schema_version": "1.0.0",
  "source_type": "institutional_page",
  "title": "Umm Al Quwain",
  "url": "https://u.ae/en/about-the-uae/the-seven-emirates/umm-al-quwain"
}
